{"$schema":"https://json-schema.org/draft/2020-12/schema","additionalProperties":false,"properties":{"android_distribution":{"enum":["undecided","managed_custom","public_consumption_only","public_play_billing","direct_distribution","not_offered"]},"approved_at_unix":{"minimum":0,"type":"integer"},"billing_provider_id":{"maxLength":128,"minLength":1,"pattern":"^[A-Za-z0-9][A-Za-z0-9_.:-]{0,127}$","type":"string"},"customer_lane":{"enum":["developer_system_integrator","direct_consumer_hardware_cloud","consumer_mobile_subscription"]},"decision_id":{"maxLength":128,"minLength":1,"pattern":"^[A-Za-z0-9][A-Za-z0-9_.:-]{0,127}$","type":"string"},"decision_owner_id":{"maxLength":128,"minLength":1,"pattern":"^[A-Za-z0-9][A-Za-z0-9_.:-]{0,127}$","type":"string"},"entitlement_source":{"enum":["undecided","contract_invoice_adapter","web_billing_adapter","apple_google_billing_adapters","multi_provider_adapters"]},"expires_at_unix":{"minimum":0,"type":"integer"},"identity_provider_id":{"maxLength":128,"minLength":1,"pattern":"^[A-Za-z0-9][A-Za-z0-9_.:-]{0,127}$","type":"string"},"ios_distribution":{"enum":["undecided","business_custom","public_free_companion","public_iap","unlisted","not_offered"]},"legal_review_id":{"maxLength":128,"minLength":1,"pattern":"^[A-Za-z0-9][A-Za-z0-9_.:-]{0,127}$","type":"string"},"policy_reviewed_on":{"format":"date","type":"string"},"revision":{"maximum":4294967295,"minimum":1,"type":"integer"},"sales_channel":{"enum":["undecided","direct_contract_invoice","direct_web_checkout","apple_google_in_app","mixed_region_specific"]},"schema_version":{"const":1},"sdk_distribution_id":{"maxLength":128,"minLength":1,"pattern":"^[A-Za-z0-9][A-Za-z0-9_.:-]{0,127}$","type":"string"},"sku":{"maxLength":64,"minLength":1,"pattern":"^[A-Z0-9][A-Z0-9_.-]{0,63}$","type":"string"},"status":{"enum":["PROPOSED","APPROVED"]},"target_markets":{"items":{"pattern":"^[A-Z]{2}$","type":"string"},"maxItems":8,"type":"array","uniqueItems":true}},"required":["schema_version","decision_id","revision","status","sku","customer_lane","target_markets","sales_channel","ios_distribution","android_distribution","entitlement_source","billing_provider_id","identity_provider_id","sdk_distribution_id","legal_review_id","decision_owner_id","policy_reviewed_on","approved_at_unix","expires_at_unix"],"title":"Xiaozhi Agent Product Launch Decision v1","type":"object"}
