{"android_distribution":"undecided","approved_at_unix":0,"billing_provider_id":"UNSELECTED","customer_lane":"developer_system_integrator","decision_id":"voice-agent-kit-launch-1","decision_owner_id":"UNSELECTED","entitlement_source":"undecided","expires_at_unix":0,"identity_provider_id":"UNSELECTED","ios_distribution":"undecided","legal_review_id":"UNSELECTED","policy_reviewed_on":"2026-08-11","revision":1,"sales_channel":"undecided","schema_version":1,"sdk_distribution_id":"UNSELECTED","sku":"VOICE_AGENT_KIT_BOX3","status":"PROPOSED","target_markets":[]}
